{
  "active_profile": null,
  "selected": null,
  "last_call": null,
  "deployment": {
    "base_revision": {"availability": "unknown"},
    "adapter_revision": {"availability": "unavailable"},
    "dataset_version": {"availability": "unknown"},
    "ab_variant": {"availability": "unavailable"}
  }
}
